{
  "schemaVersion": "1.0",
  "generatedAt": "2026-09-19T14:42:10.375116Z",
  "packageRelease": "placeholder",
  "icons": [
    {
      "key": "Architecture/Compute/Amazon-EC2",
      "group": "Architecture",
      "category": "Compute",
      "label": "Amazon EC2",
      "path": "/icons-placeholder/Architecture/Compute/Amazon-EC2.svg",
      "aliases": [
        "amazon ec2",
        "ec2",
        "instance",
        "virtual server"
      ],
      "resourceTypes": [
        "AWS::EC2::Instance"
      ]
    },
    {
      "key": "Architecture/Compute/AWS-Lambda",
      "group": "Architecture",
      "category": "Compute",
      "label": "AWS Lambda",
      "path": "/icons-placeholder/Architecture/Compute/AWS-Lambda.svg",
      "aliases": [
        "aws lambda",
        "function",
        "serverless",
        "λ"
      ],
      "resourceTypes": [
        "AWS::Lambda::Function"
      ]
    },
    {
      "key": "Architecture/Compute/Amazon-EC2-Auto-Scaling",
      "group": "Architecture",
      "category": "Compute",
      "label": "AWS Auto Scaling",
      "path": "/icons-placeholder/Architecture/Compute/Amazon-EC2-Auto-Scaling.svg",
      "aliases": [
        "asg",
        "autoscaling",
        "aws auto scaling"
      ],
      "resourceTypes": [
        "AWS::AutoScaling::AutoScalingGroup"
      ]
    },
    {
      "key": "Architecture/Compute/AWS-Batch",
      "group": "Architecture",
      "category": "Compute",
      "label": "AWS Batch",
      "path": "/icons-placeholder/Architecture/Compute/AWS-Batch.svg",
      "aliases": [
        "aws batch",
        "bat",
        "batch"
      ],
      "resourceTypes": [
        "AWS::Batch::JobQueue"
      ]
    },
    {
      "key": "Architecture/Containers/Amazon-Elastic-Container-Service",
      "group": "Architecture",
      "category": "Containers",
      "label": "Amazon ECS",
      "path": "/icons-placeholder/Architecture/Containers/Amazon-Elastic-Container-Service.svg",
      "aliases": [
        "amazon ecs",
        "container",
        "ecs"
      ],
      "resourceTypes": [
        "AWS::ECS::Cluster",
        "AWS::ECS::Service"
      ]
    },
    {
      "key": "Architecture/Containers/Amazon-Elastic-Kubernetes-Service",
      "group": "Architecture",
      "category": "Containers",
      "label": "Amazon EKS",
      "path": "/icons-placeholder/Architecture/Containers/Amazon-Elastic-Kubernetes-Service.svg",
      "aliases": [
        "amazon eks",
        "eks",
        "k8s",
        "kubernetes"
      ],
      "resourceTypes": [
        "AWS::EKS::Cluster"
      ]
    },
    {
      "key": "Architecture/Containers/Amazon-Elastic-Container-Registry",
      "group": "Architecture",
      "category": "Containers",
      "label": "Amazon ECR",
      "path": "/icons-placeholder/Architecture/Containers/Amazon-Elastic-Container-Registry.svg",
      "aliases": [
        "amazon ecr",
        "ecr",
        "registry"
      ],
      "resourceTypes": [
        "AWS::ECR::Repository"
      ]
    },
    {
      "key": "Architecture/Containers/AWS-Fargate",
      "group": "Architecture",
      "category": "Containers",
      "label": "AWS Fargate",
      "path": "/icons-placeholder/Architecture/Containers/AWS-Fargate.svg",
      "aliases": [
        "aws fargate",
        "fargate",
        "fgt"
      ],
      "resourceTypes": []
    },
    {
      "key": "Architecture/Storage/Amazon-Simple-Storage-Service",
      "group": "Architecture",
      "category": "Storage",
      "label": "Amazon S3",
      "path": "/icons-placeholder/Architecture/Storage/Amazon-Simple-Storage-Service.svg",
      "aliases": [
        "amazon s3",
        "bucket",
        "object storage",
        "s3"
      ],
      "resourceTypes": [
        "AWS::S3::Bucket"
      ]
    },
    {
      "key": "Architecture/Storage/Amazon-Elastic-Block-Store",
      "group": "Architecture",
      "category": "Storage",
      "label": "Amazon EBS",
      "path": "/icons-placeholder/Architecture/Storage/Amazon-Elastic-Block-Store.svg",
      "aliases": [
        "amazon ebs",
        "disk",
        "ebs",
        "volume"
      ],
      "resourceTypes": [
        "AWS::EC2::Volume"
      ]
    },
    {
      "key": "Architecture/Storage/Amazon-EFS",
      "group": "Architecture",
      "category": "Storage",
      "label": "Amazon EFS",
      "path": "/icons-placeholder/Architecture/Storage/Amazon-EFS.svg",
      "aliases": [
        "amazon efs",
        "efs",
        "file system"
      ],
      "resourceTypes": [
        "AWS::EFS::FileSystem"
      ]
    },
    {
      "key": "Architecture/Storage/AWS-Backup",
      "group": "Architecture",
      "category": "Storage",
      "label": "AWS Backup",
      "path": "/icons-placeholder/Architecture/Storage/AWS-Backup.svg",
      "aliases": [
        "aws backup",
        "backup",
        "bkp"
      ],
      "resourceTypes": [
        "AWS::Backup::BackupVault"
      ]
    },
    {
      "key": "Architecture/Databases/Amazon-RDS",
      "group": "Architecture",
      "category": "Databases",
      "label": "Amazon RDS",
      "path": "/icons-placeholder/Architecture/Databases/Amazon-RDS.svg",
      "aliases": [
        "amazon rds",
        "database",
        "db",
        "rds"
      ],
      "resourceTypes": [
        "AWS::RDS::DBInstance",
        "AWS::RDS::DBCluster"
      ]
    },
    {
      "key": "Architecture/Databases/Amazon-Aurora",
      "group": "Architecture",
      "category": "Databases",
      "label": "Amazon Aurora",
      "path": "/icons-placeholder/Architecture/Databases/Amazon-Aurora.svg",
      "aliases": [
        "amazon aurora",
        "aur",
        "aurora"
      ],
      "resourceTypes": [
        "AWS::RDS::DBCluster"
      ]
    },
    {
      "key": "Architecture/Databases/Amazon-DynamoDB",
      "group": "Architecture",
      "category": "Databases",
      "label": "Amazon DynamoDB",
      "path": "/icons-placeholder/Architecture/Databases/Amazon-DynamoDB.svg",
      "aliases": [
        "amazon dynamodb",
        "ddb",
        "nosql",
        "table"
      ],
      "resourceTypes": [
        "AWS::DynamoDB::Table"
      ]
    },
    {
      "key": "Architecture/Databases/Amazon-ElastiCache",
      "group": "Architecture",
      "category": "Databases",
      "label": "Amazon ElastiCache",
      "path": "/icons-placeholder/Architecture/Databases/Amazon-ElastiCache.svg",
      "aliases": [
        "amazon elasticache",
        "cache",
        "ec",
        "redis"
      ],
      "resourceTypes": [
        "AWS::ElastiCache::CacheCluster"
      ]
    },
    {
      "key": "Architecture/Networking-Content-Delivery/Amazon-Virtual-Private-Cloud",
      "group": "Architecture",
      "category": "Networking Content Delivery",
      "label": "Amazon VPC",
      "path": "/icons-placeholder/Architecture/Networking-Content-Delivery/Amazon-Virtual-Private-Cloud.svg",
      "aliases": [
        "amazon vpc",
        "network",
        "vpc"
      ],
      "resourceTypes": [
        "AWS::EC2::VPC"
      ]
    },
    {
      "key": "Architecture/Networking-Content-Delivery/Elastic-Load-Balancing",
      "group": "Architecture",
      "category": "Networking Content Delivery",
      "label": "Elastic Load Balancing",
      "path": "/icons-placeholder/Architecture/Networking-Content-Delivery/Elastic-Load-Balancing.svg",
      "aliases": [
        "alb",
        "elastic load balancing",
        "elb",
        "load balancer",
        "nlb"
      ],
      "resourceTypes": [
        "AWS::ElasticLoadBalancingV2::LoadBalancer"
      ]
    },
    {
      "key": "Architecture/Networking-Content-Delivery/Amazon-CloudFront",
      "group": "Architecture",
      "category": "Networking Content Delivery",
      "label": "Amazon CloudFront",
      "path": "/icons-placeholder/Architecture/Networking-Content-Delivery/Amazon-CloudFront.svg",
      "aliases": [
        "amazon cloudfront",
        "cdn",
        "cf",
        "delivery"
      ],
      "resourceTypes": [
        "AWS::CloudFront::Distribution"
      ]
    },
    {
      "key": "Architecture/Networking-Content-Delivery/Amazon-Route-53",
      "group": "Architecture",
      "category": "Networking Content Delivery",
      "label": "Amazon Route 53",
      "path": "/icons-placeholder/Architecture/Networking-Content-Delivery/Amazon-Route-53.svg",
      "aliases": [
        "amazon route 53",
        "dns",
        "domain",
        "r53"
      ],
      "resourceTypes": [
        "AWS::Route53::HostedZone"
      ]
    },
    {
      "key": "Architecture/Networking-Content-Delivery/Amazon-API-Gateway",
      "group": "Architecture",
      "category": "Networking Content Delivery",
      "label": "Amazon API Gateway",
      "path": "/icons-placeholder/Architecture/Networking-Content-Delivery/Amazon-API-Gateway.svg",
      "aliases": [
        "amazon api gateway",
        "api",
        "apig"
      ],
      "resourceTypes": [
        "AWS::ApiGateway::RestApi",
        "AWS::ApiGatewayV2::Api"
      ]
    },
    {
      "key": "Architecture/Networking-Content-Delivery/AWS-Transit-Gateway",
      "group": "Architecture",
      "category": "Networking Content Delivery",
      "label": "AWS Transit Gateway",
      "path": "/icons-placeholder/Architecture/Networking-Content-Delivery/AWS-Transit-Gateway.svg",
      "aliases": [
        "aws transit gateway",
        "tgw",
        "transit"
      ],
      "resourceTypes": [
        "AWS::EC2::TransitGateway"
      ]
    },
    {
      "key": "Resource/Networking-Content-Delivery/Amazon-VPC-NAT-Gateway",
      "group": "Resource",
      "category": "Networking Content Delivery",
      "label": "NAT Gateway",
      "path": "/icons-placeholder/Resource/Networking-Content-Delivery/Amazon-VPC-NAT-Gateway.svg",
      "aliases": [
        "nat",
        "nat gateway"
      ],
      "resourceTypes": [
        "AWS::EC2::NatGateway"
      ]
    },
    {
      "key": "Resource/Networking-Content-Delivery/Amazon-VPC-Internet-Gateway",